{
  "upload_type": "software",
  "title": "Citewatch: a VS Code extension that checks Zenodo and Citation File Format metadata before a software release",
  "description": "<p>A Visual Studio Code extension for making research software citable through Zenodo's GitHub integration without surprises.</p><p>It checks .zenodo.json and CITATION.cff as they are typed: required fields, Zenodo's licence vocabulary (queried live), ORCID check digits, DOI and date formats, and that every file states the same version. Mistakes that would make Zenodo silently drop a release's deposit are reported as errors. The status bar shows the concept DOI and the newest archived version, and turns amber when Zenodo's webhook is not installed on the repository, so a release is not published without its DOI. It copies the DOI and a badge that is safe in a VS Code extension's README, and sets one version across package.json, pyproject.toml, CITATION.cff and .zenodo.json.</p><p>Read-only towards Zenodo and GitHub, with no runtime dependencies and no telemetry. Unofficial; not affiliated with Zenodo, CERN or GitHub. MIT licence.</p>",
  "creators": [
    {
      "name": "Organokov, Mukharbek",
      "orcid": "0000-0002-3093-3456"
    }
  ],
  "license": "mit",
  "access_right": "open",
  "version": "0.1.1",
  "keywords": [
    "Zenodo",
    "Citation File Format",
    "DOI",
    "research software",
    "Visual Studio Code extension"
  ],
  "related_identifiers": [
    {
      "relation": "isSupplementedBy",
      "identifier": "https://github.com/kabartay/citewatch/releases",
      "scheme": "url",
      "resource_type": "software"
    }
  ]
}
